[{"limitations":["PGM-01 v1 is readable only as a lossy view; missing identities remain missing."],"mapping_version":"engineering-assurance.pgm01-compatibility-view/v1","mappings":[{"source_path":"/recordId","target_concept":"report","target_field":"legacy_record_id","value":"pgm-01-abcdef0"},{"source_path":"/subjectRevision","target_concept":"verification_execution","target_field":"source_revision","value":"bbbbbbbbbbbbbbbbbbbbbbbbbbbbbbbbbbbbbbbb"},{"source_path":"/repository","target_concept":"verification_execution","target_field":"repository","value":"ix://fictional/contract-ir"},{"source_path":"/collector/implementation","target_concept":"verification_execution","target_field":"producer.identity","value":"fictional collector"},{"source_path":"/collector/implementationRevision","target_concept":"verification_execution","target_field":"producer.source_revision","value":"cccccccccccccccccccccccccccccccccccccccc"},{"source_path":"/environment","target_concept":"verification_execution","target_field":"producer.environment","value":{"cargo":"sha256:eeeeeeeeeeeeeeeeeeeeeeeeeeeeeeeeeeeeeeeeeeeeeeeeeeeeeeeeeeeeeeee","cargoDeny":"sha256:ffffffffffffffffffffffffffffffffffffffffffffffffffffffffffffffff","codeReviewSessions":"fictional-review","jsonschema":"sha256:2222222222222222222222222222222222222222222222222222222222222222","platform":"fictional-linux","python":"sha256:1111111111111111111111111111111111111111111111111111111111111111","quire":"sha256:5555555555555555555555555555555555555555555555555555555555555555","rfc3339Validator":"sha256:3333333333333333333333333333333333333333333333333333333333333333","rfc3986Validator":"sha256:4444444444444444444444444444444444444444444444444444444444444444","rustc":"sha256:dddddddddddddddddddddddddddddddddddddddddddddddddddddddddddddddd"}},{"source_path":"/checks/0/status","target_concept":"check_result","target_field":"state","value":"passed"},{"source_path":"/checks/1/status","target_concept":"check_result","target_field":"state","value":"skipped"},{"source_path":"/outputs/0","target_concept":"evidence","target_field":"retained_output.path","value":"result.json"},{"source_path":"/outputs/1","target_concept":"evidence","target_field":"retained_output.path","value":"validation-summary.md"},{"source_path":"/limitations/0","target_concept":"report","target_field":"limitation","value":"This is a fictional compatibility fixture."}],"outcome":"lossy","source_digest":"ab20a39d307a0d3e7d2eda9d50e295ba43de34b527c8f514484cd48af6b7b7f5","source_record_id":"pgm-01-abcdef0","source_schema_version":"quire.pgm01-evidence/v1","unmapped_fields":[{"reason":"PGM-01 v1 did not record a distinct producer version","source_path":"/collector/version"},{"reason":"PGM-01 v1 did not record a configuration digest","source_path":"/configurationDigest"},{"reason":"PGM-01 v1 did not record a governing definition version","source_path":"/definitionVersion"},{"reason":"output digests live in a separate checksum file, not this manifest","source_path":"/outputs/*/digest"},{"reason":"the legacy merge-readiness label is not an ix-flow human decision event","source_path":"/decision"}]},{"limitations":["PGM-01 v2 is readable only as a lossy view; corroboration and intake status do not establish success."],"mapping_version":"engineering-assurance.pgm01-compatibility-view/v1","mappings":[{"source_path":"/recordId","target_concept":"report","target_field":"legacy_record_id","value":"pgm-02-abcdefabcdef-123456789abc"},{"source_path":"/subjectRevision","target_concept":"verification_execution","target_field":"source_revision","value":"bbbbbbbbbbbbbbbbbbbbbbbbbbbbbbbbbbbbbbbb"},{"source_path":"/repository","target_concept":"verification_execution","target_field":"repository","value":"ix://fictional/contract-ir"},{"source_path":"/collector/id","target_concept":"verification_execution","target_field":"producer.identity","value":"fictional-collector"},{"source_path":"/collector/version","target_concept":"verification_execution","target_field":"producer.version","value":"1.0.0"},{"source_path":"/collector/sha256","target_concept":"verification_execution","target_field":"producer.executable_digest","value":"5555555555555555555555555555555555555555555555555555555555555555"},{"source_path":"/parameters/sha256","target_concept":"verification_execution","target_field":"producer.configuration_digest","value":"7777777777777777777777777777777777777777777777777777777777777777"},{"source_path":"/profile/sha256","target_concept":"verification_definition","target_field":"definition_version","value":"4444444444444444444444444444444444444444444444444444444444444444"},{"source_path":"/overallStatus","target_concept":"check_result","target_field":"state","value":"failed"},{"source_path":"/commands/0/status","target_concept":"check_result","target_field":"state","value":"failed"},{"source_path":"/commands/0/stdout/path","target_concept":"evidence","target_field":"retained_output.path","value":"stdout.json"},{"source_path":"/commands/0/stdout/sha256","target_concept":"evidence","target_field":"retained_output.sha256","value":"8888888888888888888888888888888888888888888888888888888888888888"},{"source_path":"/commands/0/stdout/bytes","target_concept":"evidence","target_field":"retained_output.bytes","value":64},{"source_path":"/commands/0/stderr/path","target_concept":"evidence","target_field":"retained_output.path","value":"stderr.txt"},{"source_path":"/commands/0/stderr/sha256","target_concept":"evidence","target_field":"retained_output.sha256","value":"9999999999999999999999999999999999999999999999999999999999999999"},{"source_path":"/commands/0/stderr/bytes","target_concept":"evidence","target_field":"retained_output.bytes","value":32},{"source_path":"/limitations/0","target_concept":"report","target_field":"limitation","value":"This is a fictional compatibility fixture."}],"outcome":"lossy","source_digest":"947baf2f16a11809ca488935cb8b89fb75015eae2204293eac049b5789bd17bc","source_record_id":"pgm-02-abcdefabcdef-123456789abc","source_schema_version":"quire.pgm01-evidence/v2","unmapped_fields":[{"reason":"PGM-01 v2 did not record a complete execution environment","source_path":"/environment"},{"reason":"generic transcript corroboration is not imported as a verdict","source_path":"/commands/*/corroboration"},{"reason":"legacy intake status is not evidence sufficiency or a check result","source_path":"/quoin/status"}]}]
