[{"limitations":["No unknown schema was treated as empty or current."],"mapping_version":"engineering-assurance.pgm01-compatibility-view/v1","mappings":[],"outcome":"incompatible","source_digest":"873a5c274ec81c3296424b453decaadd7da090bfa3ba233eed50a1a19e5b3df0","source_record_id":"legacy-1","source_schema_version":"unknown","unmapped_fields":[{"reason":"unknown PGM-01 schema version","source_path":"/schemaVersion"}]},{"limitations":["No unknown schema was treated as empty or current."],"mapping_version":"engineering-assurance.pgm01-compatibility-view/v1","mappings":[],"outcome":"incompatible","source_digest":"8494536dc81e3fde9433545e030c1831e705f09b4408debf165219d24705a4de","source_record_id":"incompatible-source","source_schema_version":"quire.pgm01-evidence/v99","unmapped_fields":[{"reason":"unknown PGM-01 schema version","source_path":"/schemaVersion"}]},{"limitations":["No unknown schema was treated as empty or current."],"mapping_version":"engineering-assurance.pgm01-compatibility-view/v1","mappings":[],"outcome":"incompatible","source_digest":"1b26795dd458c5aa79fc37d286911960bc1f04d2d74f32e12aeeea75f662f0b1","source_record_id":"legacy-1","source_schema_version":"123","unmapped_fields":[{"reason":"unknown PGM-01 schema version","source_path":"/schemaVersion"}]},{"limitations":["No unknown schema was treated as empty or current."],"mapping_version":"engineering-assurance.pgm01-compatibility-view/v1","mappings":[],"outcome":"incompatible","source_digest":"d05fb144724d35852248500ce3760a60f3decc98a532471881be5b326cd50e69","source_record_id":"42","source_schema_version":"quire.pgm01-evidence/v99","unmapped_fields":[{"reason":"unknown PGM-01 schema version","source_path":"/schemaVersion"}]},{"limitations":["No unknown schema was treated as empty or current."],"mapping_version":"engineering-assurance.pgm01-compatibility-view/v1","mappings":[],"outcome":"incompatible","source_digest":"bd8cb57ec3438d90c67dac9a158e1f0fae31257d27188c7fab530b0f8e02a7e4","source_record_id":"incompatible-source","source_schema_version":"unknown","unmapped_fields":[{"reason":"unknown PGM-01 schema version","source_path":"/schemaVersion"}]}]
